{
  "schemaVersion": 1,
  "caseId": "repair-selector-drift",
  "verdict": "CONFIRM",
  "evidenceIds": [
    "obs-selector-drift",
    "adapter.ts",
    "adapter.test.ts",
    "fixtures/old.html",
    "fixtures/new.html",
    "input/policy.json"
  ],
  "violations": [],
  "residualRisks": [
    "The regex remains intentionally limited to article elements containing a direct data-name span with text-only content; materially different future markup would require new evidence and tests."
  ],
  "summary": "The candidate changes only the allowed adapter surface, anchors identity extraction to the observed stable data-athlete-id attribute, avoids treating presentation classes as authority, preserves both supplied fixtures, and passed the required deterministic test command."
}
